{
  "schema": "preset/1",
  "title": "vision 4B",
  "engine": "llamacpp",
  "engine_version": "b11588",
  "model": "qwen3-vl-4b",
  "slot": "vision",
  "options": {
    "threads": 8,
    "vision": "on",
    "vision.max_tokens": 1024
  },
  "notes": "The model that reads images (design 0008 \u00a77): Qwen3-VL 4B on 8 CPU threads at a low priority, loaded when an image is to be read and unloaded when idle (the vision settings); about 4 s to load and 8 s to read a figure (2026-10-15). None of the GPU."
}
